{
  "schemaVersion": 1,
  "screenId": "departments",
  "frameId": "157:312",
  "bounds": {
    "x": 0,
    "y": 0,
    "width": 1440,
    "height": 1068
  },
  "tree": {
    "id": "157:312",
    "name": "科室管理",
    "type": "FRAME",
    "bounds": {
      "x": 0,
      "y": 0,
      "width": 1440,
      "height": 1068
    },
    "fills": [
      {
        "type": "SOLID",
        "color": "#f5f7fa"
      }
    ],
    "children": [
      {
        "id": "281:4493",
        "name": "sidebar",
        "type": "INSTANCE",
        "bounds": {
          "x": 0,
          "y": 0,
          "width": 1440,
          "height": 1068
        },
        "children": [
          {
            "id": "I281:4493;280:2020",
            "name": "画布",
            "type": "RECTANGLE",
            "bounds": {
              "x": 0,
              "y": 0,
              "width": 1440,
              "height": 1068
            },
            "fills": [
              {
                "type": "SOLID",
                "color": "#f5f7fa"
              }
            ]
          },
          {
            "id": "I281:4493;280:2023",
            "name": "sidebar1",
            "type": "INSTANCE",
            "bounds": {
              "x": 0,
              "y": 0,
              "width": 220,
              "height": 1068
            },
            "fills": [
              {
                "type": "SOLID",
                "color": "#ffffff"
              }
            ],
            "children": [
              {
                "id": "I281:4493;280:2023;157:4529",
                "name": "border-right",
                "type": "RECTANGLE",
                "bounds": {
                  "x": 219,
                  "y": 0,
                  "width": 1,
                  "height": 1067.8
                },
                "fills": [
                  {
                    "type": "SOLID",
                    "color": "#f0f0f0"
                  }
                ]
              },
              {
                "id": "I281:4493;280:2023;157:4530",
                "name": "box",
                "type": "RECTANGLE",
                "bounds": {
                  "x": 20,
                  "y": 16.39,
                  "width": 36,
                  "height": 36
                },
                "fills": [
                  {
                    "type": "SOLID",
                    "color": "#20bf88"
                  }
                ],
                "cornerRadius": 8
              },
              {
                "id": "I281:4493;280:2023;272:1205",
                "name": "PlusOutlined",
                "type": "FRAME",
                "bounds": {
                  "x": 28,
                  "y": 22.89,
                  "width": 24,
                  "height": 24
                },
                "children": [
                  {
                    "id": "I281:4493;280:2023;272:1206",
                    "name": "Vector",
                    "type": "VECTOR",
                    "bounds": {
                      "x": 38.982,
                      "y": 25.247,
                      "width": 2.036,
                      "height": 19.286
                    },
                    "fills": [
                      {
                        "type": "SOLID",
                        "color": "#ffffff"
                      }
                    ]
                  },
                  {
                    "id": "I281:4493;280:2023;272:1207",
                    "name": "Vector",
                    "type": "VECTOR",
                    "bounds": {
                      "x": 30.357,
                      "y": 33.872,
                      "width": 19.286,
                      "height": 2.036
                    },
                    "fills": [
                      {
                        "type": "SOLID",
                        "color": "#ffffff"
                      }
                    ]
                  }
                ]
              },
              {
                "id": "I281:4493;280:2023;157:4532",
                "name": "阳光医疗门诊",
                "type": "TEXT",
                "bounds": {
                  "x": 66,
                  "y": 15,
                  "width": 96,
                  "height": 21
                },
                "fills": [
                  {
                    "type": "SOLID",
                    "color": "#262626"
                  }
                ],
                "text": {
                  "characters": "阳光医疗门诊",
                  "style": {
                    "fontFamily": "Noto Sans SC",
                    "fontSize": 16,
                    "fontWeight": 500,
                    "lineHeightPx": 20.799999237060547,
                    "letterSpacing": 0,
                    "textAlignHorizontal": "LEFT",
                    "textAlignVertical": "TOP"
                  }
                }
              },
              {
                "id": "I281:4493;280:2023;157:4533",
                "name": "预约挂号管理后台",
                "type": "TEXT",
                "bounds": {
                  "x": 66,
                  "y": 36.8,
                  "width": 96,
                  "height": 17
                },
                "fills": [
                  {
                    "type": "SOLID",
                    "color": "#8c8c8c"
                  }
                ],
                "text": {
                  "characters": "预约挂号管理后台",
                  "style": {
                    "fontFamily": "Noto Sans SC",
                    "fontSize": 12,
                    "fontWeight": 400,
                    "lineHeightPx": 16.799999237060547,
                    "letterSpacing": 0,
                    "textAlignHorizontal": "LEFT",
                    "textAlignVertical": "TOP"
                  }
                }
              },
              {
                "id": "I281:4493;280:2023;157:4534",
                "name": "首页",
                "type": "TEXT",
                "bounds": {
                  "x": 57,
                  "y": 83.8,
                  "width": 30,
                  "height": 21
                },
                "fills": [
                  {
                    "type": "SOLID",
                    "color": "#595959"
                  }
                ],
                "text": {
                  "characters": "首页",
                  "style": {
                    "fontFamily": "Noto Sans SC",
                    "fontSize": 15,
                    "fontWeight": 400,
                    "lineHeightPx": 21,
                    "letterSpacing": 0,
                    "textAlignHorizontal": "LEFT",
                    "textAlignVertical": "TOP"
                  }
                }
              },
              {
                "id": "I281:4493;280:2023;272:1208",
                "name": "HomeOutlined",
                "type": "FRAME",
                "bounds": {
                  "x": 26.52,
                  "y": 82.8,
                  "width": 24,
                  "height": 24
                },
                "children": [
                  {
                    "id": "I281:4493;280:2023;272:1209",
                    "name": "Vector",
                    "type": "VECTOR",
                    "bounds": {
                      "x": 26.378,
                      "y": 83.329,
                      "width": 24.284,
                      "height": 22.935
                    },
                    "fills": [
                      {
                        "type": "SOLID",
                        "color": "#595959"
                      }
                    ]
                  }
                ]
              },
              {
                "id": "I281:4493;280:2023;157:4536",
                "name": "机构信息",
                "type": "TEXT",
                "bounds": {
                  "x": 57,
                  "y": 127.8,
                  "width": 60,
                  "height": 21
                },
                "fills": [
                  {
                    "type": "SOLID",
                    "color": "#595959"
                  }
                ],
                "text": {
                  "characters": "机构信息",
                  "style": {
                    "fontFamily": "Noto Sans SC",
                    "fontSize": 15,
                    "fontWeight": 400,
                    "lineHeightPx": 21,
                    "letterSpacing": 0,
                    "textAlignHorizontal": "LEFT",
                    "textAlignVertical": "TOP"
                  }
                }
              },
              {
                "id": "I281:4493;280:2023;272:1210",
                "name": "MedicineBoxOutlined",
                "type": "FRAME",
                "bounds": {
                  "x": 25.63,
                  "y": 126.8,
                  "width": 24,
                  "height": 24
                },
                "children": [
                  {
                    "id": "I281:4493;280:2023;272:1211",
                    "name": "Vector",
                    "type": "VECTOR",
                    "bounds": {
                      "x": 26.916,
                      "y": 128.086,
                      "width": 21.429,
                      "height": 21.429
                    },
                    "fills": [
                      {
                        "type": "SOLID",
                        "color": "#595959"
                      }
                    ]
                  }
                ]
              },
              {
                "id": "I281:4493;280:2023;157:4538",
                "name": "科室管理",
                "type": "TEXT",
                "bounds": {
                  "x": 57,
                  "y": 171.8,
                  "width": 60,
                  "height": 21
                },
                "fills": [
                  {
                    "type": "SOLID",
                    "color": "#595959"
                  }